{
  "schema_version": "1.0",
  "trace": {
    "trace_id": "66666666-6666-4666-8666-666666666666",
    "request_id": "req-diagnostics-degraded-001",
    "timestamp_start": "2026-03-08T19:30:02Z",
    "timestamp_end": "2026-03-08T19:30:02Z",
    "host_metadata": {
      "host": "incident_service",
      "priority": 2,
      "interactive": true
    }
  },
  "query": {
    "intent": "bug_investigation",
    "targets_summary": ["module: my.app.checkout", "module: my.app.payments"],
    "constraints_summary": ["token budget 2600", "stale allowed if flagged"],
    "hints_summary": ["prefer breadth", "include tests", "suspected payment retry"],
    "options_summary": ["include tests", "include impact hints", "allow raw-code escalation"],
    "validation_status": "accepted_with_normalization"
  },
  "stages": [
    {
      "name": "query_validation",
      "status": "completed",
      "summary": "Structured query accepted after normalizing one duplicate path hint.",
      "counters": {
        "target_count": 3,
        "normalized_fields": 1
      },
      "warnings": [
        {
          "code": "hint_normalized",
          "summary": "Duplicate preferred path was removed during normalization."
        }
      ],
      "degradation_flags": [],
      "duration_ms": 3
    },
    {
      "name": "candidate_generation",
      "status": "degraded",
      "summary": "Generated a broader candidate set under partial parser coverage.",
      "counters": {
        "candidate_units": 14,
        "candidate_files": 6
      },
      "warnings": [
        {
          "code": "parser_partial",
          "summary": "One target namespace only exposed structural definitions."
        }
      ],
      "degradation_flags": [
        {
          "code": "parser_fallback",
          "summary": "Fallback parsing was used for the retry namespace."
        }
      ],
      "duration_ms": 17
    },
    {
      "name": "ranking",
      "status": "degraded",
      "summary": "Top candidates remain plausible, but one authority target is still ambiguous.",
      "counters": {
        "ranked_units": 14,
        "top_authority_units": 1
      },
      "warnings": [
        {
          "code": "target_ambiguous",
          "summary": "Two payment-related candidates remain close after structural ranking."
        }
      ],
      "degradation_flags": [
        {
          "code": "soft_signals_needed",
          "summary": "Lexical signals were needed to retain one exploratory retry unit."
        }
      ],
      "duration_ms": 9
    },
    {
      "name": "context_packet_assembly",
      "status": "completed",
      "summary": "Assembled a bounded packet with exploratory units and explicit degradations.",
      "counters": {
        "selected_units": 3,
        "selected_files": 3
      },
      "warnings": [],
      "degradation_flags": [],
      "duration_ms": 6
    },
    {
      "name": "raw_code_fetch",
      "status": "completed",
      "summary": "Fetched enclosing units for two targets, but ambiguity remained.",
      "counters": {
        "raw_fetch_requests": 2,
        "raw_fetch_units": 2
      },
      "warnings": [
        {
          "code": "raw_fetch_ambiguity_remains",
          "summary": "Extra raw code did not collapse the candidate set to one authority target."
        }
      ],
      "degradation_flags": [],
      "duration_ms": 14
    },
    {
      "name": "result_finalization",
      "status": "completed",
      "summary": "Low confidence and blocked guardrails emitted with explicit risk flags.",
      "counters": {
        "warning_count": 4,
        "degradation_count": 2
      },
      "warnings": [],
      "degradation_flags": [],
      "duration_ms": 4
    }
  ],
  "result": {
    "selected_units_count": 3,
    "selected_files_count": 3,
    "raw_fetch_level_reached": "enclosing_unit",
    "packet_size_estimate": 1520,
    "top_authority_targets": ["src/my/app/checkout.clj::my.app.checkout/submit-order"],
    "result_status": "degraded"
  },
  "warnings": [
    {
      "code": "parser_partial",
      "summary": "One target namespace only exposed structural definitions."
    },
    {
      "code": "target_ambiguous",
      "summary": "Two payment-related candidates remain close after ranking."
    }
  ],
  "degradations": [
    {
      "code": "parser_fallback",
      "summary": "Fallback parsing was used for the retry namespace."
    },
    {
      "code": "soft_signals_needed",
      "summary": "Soft ranking signals were required to preserve one exploratory unit."
    }
  ],
  "confidence": {
    "schema_version": "1.0",
    "level": "low",
    "score": 0.29,
    "reasons": [
      {
        "code": "lexical_signal_present",
        "summary": "Relevant lexical overlap exists across multiple files."
      }
    ],
    "warnings": [
      {
        "code": "parser_fallback",
        "summary": "Retrieval relied on fallback parsing for one of the key files."
      },
      {
        "code": "target_ambiguous",
        "summary": "Multiple candidate units remain plausible edit targets."
      }
    ],
    "missing_evidence": [
      {
        "code": "exact_target_resolution_missing",
        "summary": "The system could not resolve the target to a single authority definition."
      },
      {
        "code": "test_adjacency_missing",
        "summary": "No trustworthy nearby test evidence was found for the retry path."
      }
    ]
  },
  "guardrails": {
    "schema_version": "1.0",
    "autonomy_posture": "autonomy_blocked",
    "blocking_reasons": [
      {
        "code": "target_ambiguous",
        "summary": "The retrieval result did not localize a single authority target."
      },
      {
        "code": "confidence_low",
        "summary": "Confidence stayed low after fallback parsing and limited graph evidence."
      }
    ],
    "required_next_steps": [
      {
        "code": "human_review_required",
        "summary": "Request human review before drafting or applying changes."
      },
      {
        "code": "collect_stronger_evidence",
        "summary": "Expand retrieval only after narrowing the target and validating related tests."
      }
    ],
    "allowed_action_scope": {
      "mode": "analysis_only",
      "allow_multi_file_edit": false,
      "allow_apply_without_human_review": false,
      "max_raw_code_level": "local_neighborhood"
    },
    "risk_flags": [
      {
        "code": "impact_broad",
        "summary": "The likely impact surface spans multiple files and unresolved neighbors."
      },
      {
        "code": "parser_fallback",
        "summary": "One of the target files was only available through fallback parsing."
      }
    ]
  },
  "performance": {
    "total_duration_ms": 53,
    "cache_summary": {
      "cache_hits": 2,
      "cache_misses": 3
    },
    "parser_summary": {
      "primary_parsers": 2,
      "fallback_parsers": 1
    },
    "fetch_summary": {
      "raw_fetch_requests": 2,
      "raw_fetch_bytes": 1800
    },
    "budget_summary": {
      "requested_tokens": 2600,
      "estimated_tokens": 1520
    }
  }
}
